{
  "contentIdentitySha256": "604099dac10c3f8e561855e1199ac8dc38c708e98200fa85e35d91f13540176f",
  "corpusId": "GC-AGENT-CORPUS-v0.1",
  "entries": [
    {
      "artifacts": [
        {
          "path": "crates/gc_cli/tests/cli_agent_benchmark_run.rs",
          "provenance": "genesiscode-repository-authored",
          "sha256": "7e46451325d4f54d018c4b679031dab2f465898ec0fae49e4db8b9db4dfeec71",
          "spdx": "Apache-2.0"
        },
        {
          "path": "docs/spec/GC_AGENT_BENCHMARK_RUN_v0.1.schema.json",
          "provenance": "genesiscode-repository-authored",
          "sha256": "21908dfefecc0fed484d11a81adae889aaeb8e4641d17882bb4a78f9533ccc09",
          "spdx": "Apache-2.0"
        },
        {
          "path": "docs/spec/GC_AGENT_MODEL_RUNNER_EFFECT_v0.1.json",
          "provenance": "genesiscode-repository-authored",
          "sha256": "4f85f364fe6faba12d8c837ca061811bfc828ac6d5574facafeceb4bef4a4ee3",
          "spdx": "Apache-2.0"
        },
        {
          "path": "examples/agent_benchmark_reproducibility/candidate/main.gc",
          "provenance": "genesiscode-repository-authored",
          "sha256": "090c414a10639379e4264fecc5c23b0bd53cec9d3f64b8aff8b956375457e553",
          "spdx": "Apache-2.0"
        },
        {
          "path": "examples/agent_benchmark_reproducibility/candidate/requirements.md",
          "provenance": "genesiscode-repository-authored",
          "sha256": "fcf1da0c00650b4ba6f10ca8d9e3304a4d0a343505a35d759029f56cd620fd97",
          "spdx": "Apache-2.0"
        },
        {
          "path": "examples/agent_benchmark_reproducibility/caps.toml",
          "provenance": "genesiscode-repository-authored",
          "sha256": "e8873041bada0c3bc484b5063ffd1986bc1217f3fe1291bafd46c7e78831aaa7",
          "spdx": "Apache-2.0"
        },
        {
          "path": "examples/agent_benchmark_reproducibility/invocation/model-output.txt",
          "provenance": "genesiscode-repository-authored",
          "sha256": "090c414a10639379e4264fecc5c23b0bd53cec9d3f64b8aff8b956375457e553",
          "spdx": "Apache-2.0"
        },
        {
          "path": "examples/agent_benchmark_reproducibility/invocation/request.json",
          "provenance": "genesiscode-repository-authored",
          "sha256": "190c81da10911a58e939043c22c4c48961d754d8b5e35fc345f62800013b7928",
          "spdx": "Apache-2.0"
        },
        {
          "path": "examples/agent_benchmark_reproducibility/invocation/response.json",
          "provenance": "genesiscode-repository-authored",
          "sha256": "97495e4e06e5b4fa0083fb23e37255cce75a5bc3901b1f1575b87242916727fa",
          "spdx": "Apache-2.0"
        },
        {
          "path": "examples/agent_benchmark_reproducibility/model-effect.gclog",
          "provenance": "genesiscode-repository-authored",
          "sha256": "e0fd735324589400fa1fc1165e68ea83bbddba42df7a0210f78391cdfd630b64",
          "spdx": "Apache-2.0"
        },
        {
          "path": "examples/agent_benchmark_reproducibility/model_effect.gc",
          "provenance": "genesiscode-repository-authored",
          "sha256": "c8bf9421a0d7f5fb577c1aaa95840250b4ddee6dd305d713479ba590c31d629c",
          "spdx": "Apache-2.0"
        },
        {
          "path": "examples/agent_benchmark_reproducibility/models/tokenizer.json",
          "provenance": "genesiscode-repository-authored",
          "sha256": "98a4cbce097bb0ad07673d8b3447b4990f13d4c15308785f255bf34d5b497911",
          "spdx": "Apache-2.0"
        },
        {
          "path": "examples/agent_benchmark_reproducibility/models/weights.fixture",
          "provenance": "genesiscode-repository-authored",
          "sha256": "ea5ae5d06096510cc7eb945a16687f2dfce0e2f1edbc4001ab1c4c07b24be5dd",
          "spdx": "Apache-2.0"
        },
        {
          "path": "examples/agent_benchmark_reproducibility/prompts/system.md",
          "provenance": "genesiscode-repository-authored",
          "sha256": "eb437b6c7082f687a03f9959373bbb4b25841c276e67adcf9f38c2a5a57be4c6",
          "spdx": "Apache-2.0"
        },
        {
          "path": "examples/agent_benchmark_reproducibility/prompts/user.md",
          "provenance": "genesiscode-repository-authored",
          "sha256": "9b663fbddfd983886030dbb2ea62ad97f0e8b2e39ddef6d3a056a5091ca19cf3",
          "spdx": "Apache-2.0"
        },
        {
          "path": "examples/agent_benchmark_reproducibility/run.json",
          "provenance": "genesiscode-repository-authored",
          "sha256": "2bfc3a13bf5f2296260b1703940c44843a4588df1350dc5a534d3087bf0a50ff",
          "spdx": "Apache-2.0"
        },
        {
          "path": "examples/agent_benchmark_reproducibility/score.json",
          "provenance": "genesiscode-repository-authored",
          "sha256": "e57b57f2726a95d24c3fdb03dbb446d154ee856a66f592a56cc628adf11d9268",
          "spdx": "Apache-2.0"
        },
        {
          "path": "examples/agent_benchmark_reproducibility/tool-transcript.jsonl",
          "provenance": "genesiscode-repository-authored",
          "sha256": "ebd279857eb9a52648fb52396258c954d937f599f6951be5fc39b12ff062d5d9",
          "spdx": "Apache-2.0"
        },
        {
          "path": "examples/agent_benchmark_reproducibility/tools/catalog.json",
          "provenance": "genesiscode-repository-authored",
          "sha256": "f6dd3695d9f4df03f29d8eb1fa7dbb02062c0b90ad383511c02511eadcacd566",
          "spdx": "Apache-2.0"
        },
        {
          "path": "examples/agent_benchmark_reproducibility/tools/local_model_bridge.py",
          "provenance": "genesiscode-repository-authored",
          "sha256": "68dcdfaa90a5e36bd96f786df33b2d45b2c77e80cc83e1ee1e7274a4bc411359",
          "spdx": "Apache-2.0"
        },
        {
          "path": "scripts/lib/gc_agent_benchmark_run.py",
          "provenance": "genesiscode-repository-authored",
          "sha256": "fb183c7ac55601a0673ff1daee33da07dc76926749a07d471e6b1cccd26f266f",
          "spdx": "Apache-2.0"
        }
      ],
      "capabilities": [
        "host/plugin::command"
      ],
      "difficulty": {
        "concepts": [
          "artifact-inventory",
          "content-addressing",
          "local-model-effects",
          "model-agnostic-scoring",
          "replay",
          "reproducibility"
        ],
        "contextBytes": 103078,
        "level": "adversarial"
      },
      "generator": {
        "identity": "gc-agent-benchmark-run-v0.1",
        "kind": "deterministic-generator",
        "path": "scripts/lib/gc_agent_benchmark_run.py",
        "sha256": "fb183c7ac55601a0673ff1daee33da07dc76926749a07d471e6b1cccd26f266f"
      },
      "id": "agent-benchmark-reproducibility",
      "oracleExposure": "public",
      "profileId": "GC-AGENT-v0.3",
      "role": "public-test",
      "tests": [
        {
          "argv": [
            "bash",
            "scripts/check_agent_authoring_bundle.sh"
          ],
          "id": "benchmark-run-contract"
        }
      ]
    },
    {
      "artifacts": [
        {
          "path": "crates/gc_cli/tests/cli_agent_benchmark_scoring.rs",
          "provenance": "genesiscode-repository-authored",
          "sha256": "70f8f8456d9923e9a04f7f587216f81ddbe4c7e90f41d7a58716fcff7b17c3b4",
          "spdx": "Apache-2.0"
        },
        {
          "path": "docs/spec/GC_AGENT_BENCHMARK_SCORE_v0.1.schema.json",
          "provenance": "genesiscode-repository-authored",
          "sha256": "3af427864e0449effea1b72aef9bdd0e35c8e643ce35048e66df40a0da7c76b4",
          "spdx": "Apache-2.0"
        },
        {
          "path": "docs/spec/GC_AGENT_BENCHMARK_SCORING_v0.1.json",
          "provenance": "genesiscode-repository-authored",
          "sha256": "f1c72545c344274f0fb4e47ec5d7f1619f32aed68ea89d19a5b7dcac34c4359f",
          "spdx": "Apache-2.0"
        },
        {
          "path": "docs/spec/GC_AGENT_BENCHMARK_SCORING_v0.1.schema.json",
          "provenance": "genesiscode-repository-authored",
          "sha256": "54fc999a4a039809bffe4e3404f8ffbfd909f2b66839b1a602ec4b09b96ad058",
          "spdx": "Apache-2.0"
        },
        {
          "path": "scripts/lib/gc_agent_scoring.py",
          "provenance": "genesiscode-repository-authored",
          "sha256": "dcd11598b9394ec69600dd733da5e2c4b1456391629cb5086afb943d0d7ef822",
          "spdx": "Apache-2.0"
        },
        {
          "path": "scripts/lib/gc_agent_scoring_contract.py",
          "provenance": "genesiscode-repository-authored",
          "sha256": "140fa25fbf3b22878569a841deb52b12ed7140b60d397ab58e6bafda2b61079e",
          "spdx": "Apache-2.0"
        }
      ],
      "capabilities": [
        "io/fs::read"
      ],
      "difficulty": {
        "concepts": [
          "deterministic-scoring",
          "effects",
          "model-metric-separation",
          "obligations",
          "patch-minimality",
          "policy-scope",
          "resource-use",
          "semantics"
        ],
        "contextBytes": 90526,
        "level": "adversarial"
      },
      "generator": {
        "identity": "reviewed-model-agnostic-benchmark-scoring-v0.1",
        "kind": "repository-authored",
        "path": null,
        "sha256": null
      },
      "id": "agent-benchmark-scoring",
      "oracleExposure": "public",
      "profileId": "GC-AGENT-v0.3",
      "role": "public-test",
      "tests": [
        {
          "argv": [
            "bash",
            "scripts/check_agent_authoring_bundle.sh"
          ],
          "id": "agent-benchmark-scoring"
        }
      ]
    },
    {
      "artifacts": [
        {
          "path": "benchmarks/agent_tasks/v0.1/README.md",
          "provenance": "genesiscode-repository-authored",
          "sha256": "018980f953eb747c44bb5720dd71b64f75e99c856361ee6e82606012b684a496",
          "spdx": "Apache-2.0"
        },
        {
          "path": "benchmarks/agent_tasks/v0.1/inputs/completion/main.gc",
          "provenance": "genesiscode-repository-authored",